{
  "schema_version": "0.1.0",
  "record_status": "observations_added",
  "artifact": {
    "artifact_id": "CDLI:P008001",
    "designation": "MDP 06, 201",
    "museum_number": "Sb 15075",
    "collection": "Louvre Museum, Paris, France",
    "provenience": "Susa (mod. Shush)",
    "period": "Proto-Elamite (ca. 3100-2900 BC)",
    "script": "Proto-Elamite",
    "language": null,
    "language_status": "undetermined",
    "object_type": "tablet or envelope > tablet",
    "material": "clay",
    "source_url": "https://cdli.earth/search?id=P008001&layout=compact"
  },
  "observations": [{
    "observation_id": "PE-OBS-P008001-OBV-002",
    "location": "obverse line 2",
    "observation_type": "catalog_transliteration",
    "description": "CDLI publishes a transliteration entry for this line. The source locator is retained instead of copying the full transliteration into the research record.",
    "image_url": null,
    "image_rights_status": "not_applicable",
    "evidence_status": "catalog_reported",
    "source_locator": "CDLI transliteration: obverse line 2"
  }],
  "claims": [],
  "provenance": {
    "catalog_source": "Cuneiform Digital Library Initiative (CDLI)",
    "retrieved_on": "2026-10-08",
    "metadata_rights_status": "review_required",
    "image_rights_status": "not_included",
    "notes": "Observation record preserves a source locator without reproducing the catalog's full transliteration. No decipherment or sign-value claim is asserted."
  }
}
